{
  "$schema": "schema/ca.manifest.schema.json",
  "protocol": "ca.repo/1",
  "repo": "komposing/tool-bench",
  "key": "repo:komposing/tool-bench",
  "name": "tool-bench",
  "title": "Tool Bench",
  "version": "3.2.0",
  "purpose": "Single-file host for small HTML tools that front CA_V3 flows: shared config injection, sandboxed runs, tool contracts naming the CA_V3 objects each tool depends on.",
  "owner": "Nick",
  "lifecycle": "active",
  "data_class": "internal",
  "criticality": "ignore",
  "entry": "dist/tool-bench.html",
  "distribution": {
    "channel": "github_release",
    "asset": "tool-bench.html",
    "latest": "https://github.com/komposing/tool-bench/releases/latest/download/tool-bench.html",
    "record": "std:external_links repos[komposing/tool-bench]"
  },
  "bugs": {
    "object_key": "std:source_repo/komposing/tool-bench",
    "ledger": "CA_V3 bug series (dev.bug.report, dev.bug.get)",
    "trailer": "CA-Bug",
    "changelog": "### Fixed"
  },
  "source": [
    "src/bench.html",
    "tools/registry.json",
    "tools/"
  ],
  "storage": {
    "key": "toolbench:v3",
    "schema": 3,
    "migrations": [
      {
        "from": "toolbench:v1",
        "to": "toolbench:v2",
        "since": "2.0.0",
        "keeps_source": true
      },
      {
        "from": "toolbench:v2",
        "to": "toolbench:v3",
        "since": "3.0.0",
        "keeps_source": true
      }
    ]
  },
  "provides": {
    "protocols": [
      {
        "name": "tool_config_injection",
        "detail": "window.TOOL_CONFIG and window.TOOL_META injected into inline tools before their own scripts"
      },
      {
        "name": "toolbench_config_message",
        "detail": "postMessage {type: toolbench:config, config, meta} to linked tools, targeted at the link's origin"
      },
      {
        "name": "tool_file_block",
        "detail": "each tool HTML carries its card fields and version in <script type=application/json id=toolbench-tool> (toolbench.tool/1, schema/toolbench.tool.schema.json); read on import, rewritten with a higher version on save"
      },
      {
        "name": "local_storage_only",
        "detail": "state lives in the browser's localStorage only; artifact storage from earlier builds is read once to migrate, never written"
      },
      {
        "name": "error_reporter",
        "detail": "inline tools get a reporter ahead of their scripts that posts {type: toolbench:error, kind, message, source, line, col, stack} to the bench; the bench logs it locally with its own errors and copies an entry out as a dev.bug.report payload"
      },
      {
        "name": "fetched_tool",
        "detail": "a registry url entry with run fetch is fetched without credentials, its X-CA-SHA256 header (when sent) checked against the body with crypto.subtle, and run inline with tool_config_injection and error_reporter; held in memory only"
      }
    ]
  },
  "depends": {
    "ca": [
      {
        "key": "std:source_repo",
        "why": "mutation protocol this repo follows (ca.repo/1)"
      }
    ],
    "tools": [
      {
        "key": "wf:kg2yQ5MPCCNaWPZw",
        "by": [
          "TB:ca-v3-viewer"
        ]
      },
      {
        "key": "wf:knSoXj0bFCnAHpRV",
        "by": [
          "TB:ca-v3-viewer"
        ]
      },
      {
        "key": "wf:MtUvdRCD3VY7OcNu",
        "by": [
          "TB:ca-v3-viewer"
        ]
      }
    ]
  },
  "ca": {
    "kinds_known": [
      "wf",
      "tbl",
      "cred",
      "cap",
      "std",
      "doc",
      "task",
      "role",
      "fmt",
      "prj",
      "inv",
      "dia",
      "run",
      "log",
      "lease",
      "kind"
    ],
    "kinds_note": "snapshot of the declared kind prefixes (std kind via std change_broker kinds_known v9, 2026-10-23); used by the bench to flag kind_undeclared keys in tool contracts"
  },
  "governance": {
    "standard": "std:source_repo",
    "gate": "merge only after the change's deploy card lands; for a release that card writes the release record to std external_links; a change that cuts no release is gated by acceptance",
    "branch_pattern": "^c[0-9]{3,}/[a-z0-9][a-z0-9-]*$",
    "trailers": [
      "CA-Change",
      "CA-Session"
    ]
  },
  "releases": [
    {
      "version": "1.0.0",
      "commit": "d148a516d9a068520a1ee56eb81fd2de2d1fdd77",
      "change": "C308",
      "note": "baseline: v1 as delivered"
    },
    {
      "version": "2.0.0",
      "change": "C308",
      "note": "repo build, manifest, schema-2 storage with v1 migration, tool contracts, per-tool history, hardening"
    },
    {
      "version": "3.0.0",
      "change": "C350",
      "note": "localStorage-only storage (schema 3); tool files carry their card fields and a version the bench bumps on save"
    },
    {
      "version": "3.0.1",
      "change": "C579",
      "note": "each release is published as a GitHub Release with the built file attached; manifest declares distribution"
    },
    {
      "version": "3.1.0",
      "change": "C688",
      "note": "Errors and fixes: error log panel (tool and bench errors, copy as bug report), Fixed in this version; CA-Bug trailer and ### Fixed checks (ca.repo/1 v3)"
    },
    {
      "version": "3.2.0",
      "change": "C765",
      "note": "CA_V3 Viewer registered as a repo link tool (served by CA_V3 Viewer Host), fetched and run inline (run fetch, X-CA-SHA256 checked)"
    }
  ]
}
